study_id,study_label,contributors
pf7_1001_PF_ML_DJIMDE,Developing the Community Project with partners in Mali,Abdoulaye Djimde
pf7_1004_PF_BF_OUEDRAOGO,Developing the Community Project with partners in Burkina Faso,Jean-Bosco Ouedraogo
pf7_1006_PF_GM_CONWAY,Genome-wide analysis of genetic variation in The Gambia,"Alfred Amambua-Ngwa, David J Conway"
pf7_1007_PF_TZ_DUFFY,Mother Offspring Malaria Study (MOMS) in Tanzania,Patrick Duffy
pf7_1015_PF_KE_NZILA,Genome-wide association study of in vitro drug resistance in Kenya,"Irene Omedo, Steffen Borrmann, Alexis Nzila, Norbert Peshu, Philip Bejon"
pf7_1017_PF_GH_AMENGA_ETEGO,Population genetics of natural populations in Northern Ghana,"Lucas Amenga-Etego, Abraham Oduro, Patrick O Ansah"
pf7_1022_PF_MW_OCHOLLA,Genome variation and selection in clinical isolates from rural Malawi,"Brigitte Denis, Alister Craig, Jaqui Montgomery, Harold Ocholla"
pf7_1024_PF_UG_BOUSEMA,FightMal - Correlating protection from malaria with immune profile of infected individuals in Uganda,"Teun Bousema, Federica Verra, Thomas G Egwang, Chris Drakeley"
pf7_1026_PF_GN_CONWAY,Effects of transmission intensity on population structure and signatures of selection in Guinea,"David J Conway, Victor Mobegi, Alfred Amambua-Ngwa, Kovana Marcel Loua"
pf7_1027_PF_KE_BULL,Genomics of severe malaria and low host immunity in Kenya,"Irene Omedo, Vandana Thathy, Peter C Bull"
pf7_1052_PF_TRAC_WHITE,Tracking Resistance to Artemisinin Collaboration (TRAC),"Elizabeth Ashley, Arjen Dondorp, Nicholas White, Mehul Dhorda"
pf7_1083_PF_GH_CONWAY,Alternative molecular mechanisms for erythrocyte invasion by Plasmodium falciparum in Ghana,"Gordon Awandare, David J Conway"
pf7_1093_PF_CM_APINJOH,Population genetics of Plasmodium falciparum parasites in South-Western Cameroon,Tobias Apinjoh
pf7_1094_PF_GH_AMENGA_ETEGO,Population genetics of Plasmodium falciparum parasites in Northern Ghana,Lucas Amenga-Etego
pf7_1095_PF_TZ_ISHENGOMA,Genome variation and its effect on ACT treatment outcome in Tanzania,"Deus Ishengoma, Alex Shayo, Vito Baraka"
pf7_1096_PF_GH_GHANSAH,Population genetics of Plasmodium falciparum parasites in Southern Ghana,Anita Ghansah
pf7_1097_PF_ML_MAIGA,Detection of artemisinin-resistant Plasmodium falciparum parasites in Southern Mali,"Abdoulaye DjimdŽ, Oumou Ma•ga-AscofarŽ"
pf7_1098_PF_ET_GOLASSA,"The prevalence of asymptomatic carriage; emergence of parasite mutations conferring anti-malaria drug resistance; and G6PD deficiency in the human population, as possible impediments to malaria elimination in Ethiopia","Lemu Golassa, Berhanu Erko"
pf7_1100_PF_CI_YAVO,Drug resistance and Plasmodium falciparum diversity in forest zone of C™te dŐIvoire,"William Yavo, Abibatou KonatŽ"
pf7_1101_PF_CD_ONYAMBOKO,Efficacy of three ACTs in treating falciparum malaria in the Democratic Republic of Congo,"Caterina A Fanello, Antoinette Tshefu, Nicholas Day, Marie A Onyamboko"
pf7_1102_PF_MG_RANDRIANARIVELOJOSIA,Genotyping Plasmodium falciparum and Plasmodium vivax in Madagascar,Milijaona Randrianarivelojosia
pf7_1103_PF_PDN_GMSN_NGWA,Population genetics of cross-border Plasmodium falciparum parasites in West Africa,Alfred Amambua-Ngwa
pf7_1107_PF_KEN_KAMAU,Population genetics of Plasmodium falciparum parasites in Kenya,"Ben Andagalu, Edwin Kamau"
pf7_1108_PF_GAB_BOUYOU_AKOTET,Determining parasite genetic diversity in Gabon,Marielle Bouyou-Akotet
pf7_1114_PF_PDN_DBS_GH_GHANSAH,Surveillance of kelch-13 mutation in Ghana,Anita Ghansah
pf7_1127_PF_ML_SOULEYMANE,Genetic analysis of Plasmodium falciparum before and after artemether-lumefantrine treatment in Mali,"Abdoulaye DjimdŽ, Souleymane Dama"
pf7_1131_PF_BJ_BERTIN,Identification of virulence factors in cerebral malaria in Benin,"Gwladys Bertin, Claire Kamaliddin"
pf7_1132_PF_K1000G_DBS_KE_BEJON,"Using whole genome sequence data to analyse the spatio-temporal genetic diversity of malaria parasites in Kilifi, Kenya","Irene Omedo, Philip Bejon, Lynette I. Oyier"
pf7_1134_PF_ML_CONWAY,Population genetics of Plasmodium falciparum in West Africa,"David J Conway, Mahamadou Diakite"
pf7_1135_PF_SN_CONWAY,"Parasite adaption in Senegal at molecular, functional and population level","David J Conway, Ambroise Ahouidi"
pf7_1136_PF_GM_NGWA,Plasmodium falciparum anti-malarial drug resistance in the Gambia: Identification of potential genetic markers by retrospective whole genome approaches,Alfred Amambua-Ngwa
pf7_1137_PF_GM_DALESSANDRO,Malaria transmission dynamics in The Gambia: Defining the spatial and temporal spread of malaria at micro-level (village),"Alfred Amambua-Ngwa, Umberto D'Alessandro"
pf7_1138_PF_CD_FANELLO,Parenteral artesunate compared to quinine as a cause of late post-treatment anaemia in African children with hyperparasitaemic Plasmodium falciparum malaria (DHART),"Caterina A Fanello, Marie A Onyamboko"
pf7_1140_PF_ML_DUFFY,"PfSPZ phase I trial in Doneguebougou, Mali","Jason Wendler, Patrick Duffy, Ogobara Doumbo, Sara Healy, Mahamadou S. Sissoko"
pf7_1141_PF_GM_CLAESSENS,Genomic characterization of Plasmodium falciparum from asymptomatic infections in The Gambia,Antoine Claessens
pf7_1146_PF_MULTI_PRICE,Characterisation of drug resistance in Indonesian Plasmodium falciparum populations,"Sarah Auburn, Rintis Noviyanti, Ric N Price, Jutta Marfurt"
pf7_1147_PF_MR_CONWAY,Population genetics of Plasmodium falciparum parasites in Mauritania,"David J Conway, Hampate Ba"
pf7_1151_PF_GH_AMENGA_ETEGO,Testing the effectiveness of selective whole genome amplification on samples collected in Northern Ghana,"Lucas Amenga-Etego, Abraham Oduro"
pf7_1162_PF_GM_NGWA_SM,Genomic variation and antimalarial resistance evolution in The Gambia,"Alfred Amambua-Ngwa, Umberto D'Alessandro"
pf7_1164_PF_ML_DJIMDE_SM,Plasmodium falciparum clearance times in Malian villages following artesunate monotherapy,"Abdoulaye DjimdŽ, Aminatou Kone"
pf7_1165_PF_CM_APINJOH_SM,Prevalence of gene polymorphisms in symptomatic and asymptomatic Plasmodium falciparum infected individuals from the Southwest region of Cameroon,"Tobias Apinjoh, Vincent Ntui-Njock Ntui"
pf7_1167_PF_TZ_ISHENGOMA_SM,"Surveillance of parasite populations and patterns of drug resistance, and associated parasite clearance or treatment failure in Tanzania","Deus Ishengoma, Martha Lemnge, Celine Mandara"
pf7_1168_PF_GH_AMENGA_ETEGO_SM,"Genomic surveillance of Plasmodium falciparum in the Kassena-Nankana Districts, Ghana","Lucas Amenga-Etego, Abraham Oduro, Abraham Hodgson"
pf7_1182_PF_GM_DALESSANDRO_SM,Understanding the determinants of malaria heterogeneity and the spatial and temporal spread of malaria in The Gambia,"Alfred Amambua-Ngwa, Umberto D'Alessandro"
pf7_1183_PF_GH_AWANDARE_SM,Alternative mechanisms for erythrocyte invasion by Plasmodium falciparum,"Gordon Awandare, Collins MorangŐa, Wellington Aghoghovwia Oyibo, Ifeyinwa Aniebo, Felix Ansah, David Conway, Lucas Amenga-Etego"
pf7_1192_PF_ML_FAIRHURST_SM,Genomic surveillance of Plasmodium falciparum in Mali,"Thomas E Wellems, Chanaki Amaratunga, Mahamadou Diakite"
pf7_1195_PF_TRAC2_DONDORP,Tracking Artemisinin Resistance Collaboration (TRAC II),"Arjen Dondorp, Rob van der Pluijm, Olivo Miotto"
pf7_1197_PF_ML_DIAKITE_SM,Multidisciplinary research for malaria control and prevention in Mali,"Mahamadou Diakite, Seydou Doumbia, Drissa Konate, Mahamoudou Toure, Sekou F. Traore, Merepen dite Agnes Guindo"
pf7_1199_PF_ML_LAWNICZAK,Developing SpotMalaria with partners in Mali,"Mara Lawniczak, Abdoulaye Djimde, Arthur Talman"
pf7_1200_PF_GH_MAIGA_SM,Genomic surveillance of Plasmodium falciparum in the Ashanti region of Ghana,Oumou Ma•ga-AscofarŽ
pf7_1223_PF_MZ_ROSANAS_URGELL,"Evaluation of intermittent preventive treatment during pregnancy (IPTp) in Ch—kwŹ district, Southern Mozambique (acronym IPTpCHOKWE)","Anna Rosanas-Urgell, Paulo Arnaldo, Sonia Maria Mauricio Enosse"
pf7_1241_PF_GH_ANINAGYEI,Viability and pathogenicity of Plasmodium spp in infected blood donor units and immunological and genetic markers associated with malaria infections,"Enoch Aninagyei, Desmond Omane Acheampong"
pf7_1247_PF_SD_HAMID_SM,Surveillance of antimalarial drug resistance related genes in Plasmodium falciparum in Sudan,"Muzamil Mahdi Abdel Hamid, Mohamed Hassan Abdelraheem, Maazza Hussien, Abdelrahim Osman Mohamed"